<?xml version="1.0"?>
<xs:schema xmlns:xs="http://www.w3.org/2001/XMLSchema">

    <xs:element name="products">
        <xs:complexType>
            <xs:sequence>
                <xs:element name="product" maxOccurs="unbounded">
                    <xs:complexType>
                        <xs:sequence>
                            <xs:element name="id" type="xs:int"/>
                            <xs:element name="image" type="xs:string"/>
                            <xs:element name="name" type="xs:string"/>
                            <xs:element name="price" type="xs:decimal"/>
                            <xs:element name="color" type="xs:string"/>
                            <xs:element name="description" type="xs:string"/>
                        </xs:sequence>
                    </xs:complexType>
                </xs:element>
            </xs:sequence>
        </xs:complexType>
    </xs:element>

</xs:schema>
